{
  "schema_version": "1.0",
  "tenant_id": "ten_demo",
  "correlation_id": "corr_4c21f9",
  "chain": {
    "verified": true,
    "head_event_id": "recev_1001",
    "head_hash": "sha256:48c0c99009edccc44b7b567a9d944ed330470a49e4e7a021e8ef4ee1c5c678de"
  },
  "events": [
    {
      "schema_version": "3.0",
      "tenant_id": "ten_demo",
      "correlation_id": "corr_4c21f9",
      "event_id": "recev_1001",
      "seq": 1,
      "prev_hash": "sha256:214fe86072737c56f28c9cabda0aa25914a680a82584aacf38bce57e7055e05c",
      "written_by": "core-trust",
      "actor": "core-trust",
      "event_type": "CLARIFICATION_REQUESTED",
      "object_ref": "clr_3B",
      "payload_hash": "sha256:44136fa355b3678a1146ad16f7e8649e94fb4fc21fe77e8310c060f61caaff8a",
      "at": "2026-10-01T09:47:55Z",
      "hash": "sha256:48c0c99009edccc44b7b567a9d944ed330470a49e4e7a021e8ef4ee1c5c678de"
    }
  ],
  "sections": [
    {
      "kind": "WHO",
      "items": []
    },
    {
      "kind": "REQUEST",
      "items": []
    },
    {
      "kind": "AMBIGUITY",
      "items": [
        {
          "record_event_id": "recev_1001",
          "object_ref": "clr_3B",
          "basis": "RULE",
          "facts": {
            "clarification_asked": true
          }
        }
      ]
    },
    {
      "kind": "RESOLUTION",
      "items": []
    },
    {
      "kind": "OBSERVED_STATE",
      "items": []
    },
    {
      "kind": "POLICY",
      "items": []
    },
    {
      "kind": "AUTHORITY",
      "items": []
    },
    {
      "kind": "DECISION",
      "items": []
    },
    {
      "kind": "ACTION",
      "items": []
    },
    {
      "kind": "DOWNSTREAM_RESULT",
      "items": []
    },
    {
      "kind": "VERIFICATION",
      "items": []
    },
    {
      "kind": "EXPLANATION",
      "items": []
    }
  ],
  "timeline": [
    {
      "record_event_id": "recev_1001",
      "at": "2026-10-01T09:47:55Z",
      "event_type": "CLARIFICATION_REQUESTED",
      "text": "Clarification asked"
    }
  ]
}
