{
  "schema_version": "1.0",
  "tenant_id": "ten_demo",
  "correlation_id": "corr_4c21f9",
  "chain": {
    "verified": true,
    "head_event_id": "recev_1005",
    "head_hash": "sha256:f2f2c8bb18fd7a44efbbf78d1ff086e8197f31fddd0442b243d3b2a921df0068"
  },
  "events": [
    {
      "schema_version": "2.0",
      "tenant_id": "ten_demo",
      "correlation_id": "corr_4c21f9",
      "event_id": "recev_1001",
      "seq": 1,
      "prev_hash": "sha256:214fe86072737c56f28c9cabda0aa25914a680a82584aacf38bce57e7055e05c",
      "written_by": "TRUST",
      "actor": "TRUST",
      "event_type": "INTENT_ADMITTED",
      "object_ref": "int_01J9X3",
      "payload_hash": "sha256:44136fa355b3678a1146ad16f7e8649e94fb4fc21fe77e8310c060f61caaff8a",
      "at": "2026-10-01T09:47:50Z",
      "hash": "sha256:dfbb5dc427a4faffaff87e6f6402952b9d7cd550c76d43f97e070173465f71a3"
    },
    {
      "schema_version": "2.0",
      "tenant_id": "ten_demo",
      "correlation_id": "corr_4c21f9",
      "event_id": "recev_1002",
      "seq": 2,
      "prev_hash": "sha256:dfbb5dc427a4faffaff87e6f6402952b9d7cd550c76d43f97e070173465f71a3",
      "written_by": "RESOLUTION",
      "actor": "RESOLUTION",
      "event_type": "CANDIDATES_RESOLVED",
      "object_ref": "cns_7A",
      "payload_hash": "sha256:44136fa355b3678a1146ad16f7e8649e94fb4fc21fe77e8310c060f61caaff8a",
      "at": "2026-10-01T09:47:51Z",
      "hash": "sha256:82262d6e6e0850d6035519e13a74538f3df279779b0ab3aaa3d34900223bc62b"
    },
    {
      "schema_version": "2.0",
      "tenant_id": "ten_demo",
      "correlation_id": "corr_4c21f9",
      "event_id": "recev_1003",
      "seq": 3,
      "prev_hash": "sha256:82262d6e6e0850d6035519e13a74538f3df279779b0ab3aaa3d34900223bc62b",
      "written_by": "TRUST",
      "actor": "TRUST",
      "event_type": "DECISION_MADE",
      "object_ref": "dec_8R4",
      "payload_hash": "sha256:44136fa355b3678a1146ad16f7e8649e94fb4fc21fe77e8310c060f61caaff8a",
      "at": "2026-10-01T09:48:00Z",
      "hash": "sha256:b71cfa62c11c857cf8a16fb88c79c38876984afc00e96c7b3006fdbcfd77080d"
    },
    {
      "schema_version": "2.0",
      "tenant_id": "ten_demo",
      "correlation_id": "corr_4c21f9",
      "event_id": "recev_1004",
      "seq": 4,
      "prev_hash": "sha256:b71cfa62c11c857cf8a16fb88c79c38876984afc00e96c7b3006fdbcfd77080d",
      "written_by": "EXECUTION",
      "actor": "EXECUTION",
      "event_type": "RECEIPT",
      "object_ref": "rcp_5T",
      "payload_hash": "sha256:44136fa355b3678a1146ad16f7e8649e94fb4fc21fe77e8310c060f61caaff8a",
      "at": "2026-10-01T09:48:05Z",
      "hash": "sha256:f340cdd5a5e7be1f92638bc2f6b320f288191bbe3822490f459142dff73637a9"
    },
    {
      "schema_version": "2.0",
      "tenant_id": "ten_demo",
      "correlation_id": "corr_4c21f9",
      "event_id": "recev_1005",
      "seq": 5,
      "prev_hash": "sha256:f340cdd5a5e7be1f92638bc2f6b320f288191bbe3822490f459142dff73637a9",
      "written_by": "OUTCOME",
      "actor": "OUTCOME",
      "event_type": "VERDICT",
      "object_ref": "ver_9P0",
      "payload_hash": "sha256:44136fa355b3678a1146ad16f7e8649e94fb4fc21fe77e8310c060f61caaff8a",
      "at": "2026-10-01T09:49:10Z",
      "hash": "sha256:f2f2c8bb18fd7a44efbbf78d1ff086e8197f31fddd0442b243d3b2a921df0068"
    }
  ],
  "sections": [
    {
      "kind": "WHO",
      "items": []
    },
    {
      "kind": "REQUEST",
      "items": [
        {
          "record_event_id": "recev_1001",
          "object_ref": "int_01J9X3",
          "basis": "PRINCIPAL_ACTION",
          "facts": {
            "intent_node": "fin.int.escalate_missing_credit"
          }
        }
      ]
    },
    {
      "kind": "AMBIGUITY",
      "items": []
    },
    {
      "kind": "RESOLUTION",
      "items": [
        {
          "record_event_id": "recev_1002",
          "object_ref": "cns_7A",
          "basis": "RULE",
          "facts": {
            "resolved_target": "fin.transaction:TX88213",
            "candidate_count": 1
          }
        }
      ]
    },
    {
      "kind": "OBSERVED_STATE",
      "items": []
    },
    {
      "kind": "POLICY",
      "items": []
    },
    {
      "kind": "AUTHORITY",
      "items": []
    },
    {
      "kind": "DECISION",
      "items": [
        {
          "record_event_id": "recev_1003",
          "object_ref": "dec_8R4",
          "basis": "RULE",
          "facts": {
            "decision_outcome": "ALLOW",
            "reason_codes": [
              "fin.reason.credit_missing"
            ]
          }
        }
      ]
    },
    {
      "kind": "ACTION",
      "items": [
        {
          "record_event_id": "recev_1004",
          "object_ref": "rcp_5T",
          "basis": "RULE",
          "facts": {
            "capability_id": "fin.cap.create_escalation_case",
            "execution_state": "ACKNOWLEDGED",
            "attempt": 1,
            "grant_state": "VALID"
          }
        }
      ]
    },
    {
      "kind": "DOWNSTREAM_RESULT",
      "items": []
    },
    {
      "kind": "VERIFICATION",
      "items": [
        {
          "record_event_id": "recev_1005",
          "object_ref": "ver_9P0",
          "basis": "EVIDENCE",
          "facts": {
            "capability_id": "fin.cap.create_escalation_case",
            "verdict": "ACHIEVED"
          }
        }
      ]
    },
    {
      "kind": "EXPLANATION",
      "items": [
        {
          "record_event_id": "recev_1005",
          "object_ref": "ver_9P0",
          "basis": "RULE",
          "facts": {
            "fact_id": "f_case",
            "text": "A case was opened for your transfer.",
            "bound_fact_status": "KNOWN",
            "disclosed_refs": [
              "fin.transaction:TX88213"
            ]
          }
        }
      ]
    }
  ],
  "timeline": [
    {
      "record_event_id": "recev_1001",
      "at": "2026-10-01T09:47:50Z",
      "event_type": "INTENT_ADMITTED",
      "text": "Intent admitted"
    },
    {
      "record_event_id": "recev_1002",
      "at": "2026-10-01T09:47:51Z",
      "event_type": "CANDIDATES_RESOLVED",
      "text": "One candidate resolved"
    },
    {
      "record_event_id": "recev_1003",
      "at": "2026-10-01T09:48:00Z",
      "event_type": "DECISION_MADE",
      "text": "Decision: ALLOW"
    },
    {
      "record_event_id": "recev_1004",
      "at": "2026-10-01T09:48:05Z",
      "event_type": "RECEIPT",
      "text": "Receipt: ACKNOWLEDGED"
    },
    {
      "record_event_id": "recev_1005",
      "at": "2026-10-01T09:49:10Z",
      "event_type": "VERDICT",
      "text": "Verdict: ACHIEVED"
    }
  ]
}
